{
  "$schema":"https://json-schema.org/draft/2020-12/schema",
  "$id":"BAUMAN_ROADMAP_V2_PRODUCTION_PROMOTION_AUTHORIZATION_CONTRACT_V1",
  "type":"object",
  "additionalProperties":false,
  "required":["schema","version","purpose","mode","upstreamSchemas","candidatePolicy","authorizationPolicy","outputPolicy","capabilities","abortConditions","acceptance"],
  "properties":{
    "schema":{"const":"BAUMAN_ROADMAP_V2_PRODUCTION_PROMOTION_AUTHORIZATION_CONTRACT_V1"},
    "version":{"type":"string","minLength":1},
    "purpose":{"type":"string","minLength":1},
    "mode":{"type":"object"},
    "upstreamSchemas":{"type":"object"},
    "candidatePolicy":{"type":"object"},
    "authorizationPolicy":{"type":"object"},
    "outputPolicy":{"type":"object"},
    "capabilities":{"type":"object"},
    "abortConditions":{"type":"array","minItems":1,"items":{"type":"string","minLength":1}},
    "acceptance":{"type":"object"}
  }
}
